How Artificial Intelligence is Improving Cloud Computing? - GeeksforGeeks,https://www.geeksforgeeks.org/how-artificial-intelligence-is-improving-cloud-computing/,14.5,Alan Mathison Turing|Alexa|Siri|Salesforce Einstein|Salesforce,Enhanced Data Management Today|Google|Artificial Intelligence|Artificial Intelligence and Cloud Computing,Assistant|host|model|mathematician|Layer
The Dip in This Edge Computing Leader Is a Gift | The Motley Fool,https://www.fool.com/investing/2021/12/03/the-dip-in-this-edge-computing-leader-is-a-gift/,14.25,Bradley Guichard|Cloudflare,Getty Images|Motley Fool's Premium Investing Services|YAHOO Cloudflare|Cloudflare, Inc.|IPO|Motley Fool,leader|Leader|retailer|analyst|writer
New satellite connectivity and geospatial capabilities with Azure Space,https://azure.microsoft.com/en-us/blog/new-satellite-connectivity-and-geospatial-capabilities-with-azure-space/,32.25,Pléiades|Rolf Skatteboe|Tom Keane|Richard Cooke|François Lombard|Blackshark.ai,Esri|USEI|GitHub|Airbus Microsoft|ST Engineering|ViaSat|Airbus Defense|Airbus|Microsoft Research|Digital IF Interoperability|Orbital Insight|KSAT|Azure Global|Microsoft|Azure Orbital|Esri Microsoft,general|leader|director|Vice President|CEO
AWS Re:Invent Re:Cap 2021,https://aws.plainenglish.io/aws-re-invent-re-cap-2021-9cfffbd0b4c5,25.25,Matt|Werner Vogel|James Beswick|his|Adam Selipsky|Talia Nassi|SAM Accelerate|Matt Coulter|Julian Wood|he|Healthy Serverless,Google|Amazon Aurora Serverless|Liberty Mutual|United|Boston Dynamics|AWS|CTO,general|software engineer|developer|Private|CEO
Wall Street panic about SaaS companies is completely misguided – TechCrunch,https://social.techcrunch.com/2021/12/07/wall-street-panic-about-saas-companies-is-completely-misguided/,29.0,DocuSign|Ron Miller|ServiceNow|Adam Selipsky|his|Ryan|Ryan Lawler|Salesforce,Google|Wall Street|Synergy Research|Okta|Salesforce,leader|boss|buyer
Cybersecurity Statistics for 2021 | Cobalt Blog,https://cobalt.io/blog/cybersecurity-statistics-2021,51.5,Blackbaud|Optiv,Accenture -RRB- Research|Small Business Administration|Carbon Black|Cybersecurity Ventures|Comparitech|HIPAA Journal|Cincinnati Enquirer|Bleeping Computer|Bull Guard|Twitter|FBI|SBA|IBM|ABC News|NCBI|Microsoft|Cybercrime Magazine|Symantec|Google|Symantec -RRB- Social Engineering Attacks Statistics|CSO Online|Identity Force|CNBC|National Security Institute|Verizon|Alliant|CRN|Walgreens,Rep.
101 Best Georgia FinTech Startups - The Future of FinTech,https://startupill.com/101-best-georgia-fintech-startups-the-future-of-fintech/,46.0,Patientco Patientco|Ingo Money Ingo Money|Carputty Carputty|Charityvest Charityvest|Kabbage Kabbage|Layr Layr|Bakkt Bakkt|AlgoValue AlgoValue|Bitcoin|GreenSky GreenSky,Delta Data Delta Data|TradeRocket, Inc.|Fintech & Consumertech Company Incorporating Real Estate, Technology|Lucena Research Lucena Research|NCR NCR|NetRoadshow Providing U.S. Securities & Exchange Commission|Agora Agora Services|Atlantic Capital Bank Atlantic Capital Bank|CityPay.io Cryptocurrency Payment Gateway for any Type of Businesses TransacXion Technologies Fintech|Verady Audit & Accounting Platform for Blockchain Assets VIVA Finance VIVA Finance|First Century Bank First Century Bank|BasisCode Compliance BasisCode Compliance|Financial Services|Fintech|Computis Premium B2B Accounting Software for Digital Assets Atlas InsurTech Insurtech|Greenwood Bank Greenwood Bank|FormFree FormFree Holdings|FI Navigator FI Navigator Corporation|Bluefin Bluefin|KyckGlobal, Inc.|SEC|Gilmore Homes|Commissiontrac Back Office Intelligence for the Commercial Real Estate Industry Vodi Vodi|MicroBilt Corporation MicroBilt Corporation|Gravy Gravy|Artis Technologies Artis Technologies|Primerica Primerica|RoadSync RoadSync|Instant Financial Instant Financial,leader|Assistant|Tier|mobile
'Shift left' doesn't complete DevSecOps story for fintech,https://searchitoperations.techtarget.com/news/252510820/Shift-left-doesnt-complete-DevSecOps-story-for-fintech,55.75,She|David BiesackChief|his|Beth Pariseau|DevSecOps|Imperva|Biesack|David Biesack|he|Apiture,Gartner|Spherical Defense|Cisco|API|Traceable Inc|Apiture|TechTarget,general|hacker|vendor|Developer|developer|model|writer|Writer
SaaS based Intelligent Document Processing | elDoc - Integrated Automated Platform,https://dms-solutions.co/blog/intelligent-document-processing-saas-key-advantages/,9.5,,Integrated Intelligent Automated Platform|Intelligent Document Processing|IDP|Advanced Technology UiPath Alliance Partner and Technology Blue Prism Alliance Partner|Computer Vision,vendor|model
AIOps: Beat the DevOps Arms Race,https://www.datanami.com/2021/12/09/aiops-beat-the-devops-arms-race/,14.75,Ariel Assaraf|Wright|William Hill|Sergey Nivens/Shutterstock,Google|Coralogix|KPN,author|model|CEO|co-founder
UnMarkDocs Avis Prix & Alternatives | Comparateur Logiciels.Pro,https://www.logiciels.pro/logiciel-saas/unmarkdocs/,22.75,Deways|GitHub|Voici|Kofax,Google|Google Search Appliance|Compatibilité & Configuration Logiciel|IBM FileNet|Intégrations & API|Epson|Voici|Logiciels Gestion de Documents|Lexmark,installer|mobile|guide
When Will Security Frameworks Catch Up With the New Cybersecurity Normal?,https://www.darkreading.com/endpoint/when-will-security-frameworks-catch-up-with-the-new-cybersecurity-normal-,18.0,,Google Workspace|ISO|NIST Cybersecurity Framework|NIST|Microsoft|Alamy Stock Photo PDF|Better Endpoint Protection Most,
Council Post: Targeting Cloud Security Failures At Their Root: Configuration Errors,https://www.forbes.com/sites/forbestechcouncil/2021/09/23/targeting-cloud-security-failures-at-their-root-configuration-errors/,12.25,,Google|Forbes Technology Council|Gartner, Inc.|Microsoft,owner
JFrog and AWS Unveil Hybrid Solution for Boosting DevOps Pipelines on Kubernetes Infrastructures | MarketScreener,https://www.marketscreener.com/quote/stock/JFROG-LTD-112440355/news/JFrog-and-AWS-Unveil-Hybrid-Solution-for-Boosting-DevOps-Pipelines-on-Kubernetes-Infrastructures-37168250/,17.25,Yoav Landman|Bob Wise|JFrog|Martin Eggenberger,Securities and Exchange Commission|SEC|JFrog Ltd.|Monster.com|Amazon Web Services, Inc.|Amazon EKS Anywhere|Amazon Elastic Kubernetes Service|Amazon EKS|Amazon|Business Wire,Architect|general|Co-Founder|manager|General Manager|Manager|Chief Technology Officer
SpyBot Avis Prix & Alternatives | Comparateur Logiciels.Pro,https://www.logiciels.pro/logiciel-saas/spybot/,23.75,Slack|Lancope|Voici|Doudet Charlet|Darktrace,Compatibilité & Configuration Logiciel|Logiciels Sécurité Informatique|Logiciels Achats|Voici|Avantages de SpyBot Voici,installer|mobile|scanner|guide
Sql Assist Avis Prix & Alternatives | Comparateur Logiciels.Pro,https://www.logiciels.pro/logiciel-saas/sql-assist/,23.25,Bomgar|Voici,Avis|Compatibilité & Configuration Logiciel|Softtree Technologies|Intégrations & API|Logiciels Informatique|VMware Horizon|IBM Watson|Barracuda Networks|IBM|Voici|Amazon Lex|Microsoft|DSI,installer|mobile|tester|Oracle|guide
Mambu fundraise pushes valuation to $4.9bn,https://www.finextra.com/pressarticle/90655/mambu-fundraise-pushes-valuation-to-49bn,12.75,BancoEstado|Mambu|Carolina Brochado|Eugene Danilkis|Mambu Mambu,EQT Growth|Gartner|Articles of Association|Raiffeisen Bank|EQT Growth's Advisory Team|ABN Amro,author|model|CEO|co-founder
Unigma Avis Prix & Alternatives | Comparateur Logiciels.Pro,https://www.logiciels.pro/logiciel-saas/unigma/,19.5,Unigma|Workato,Avis|Unigma|NOC|FinTech|Voici|Digital Studio Transmedia|MSP,installer|mobile|guide
Velostics Raises $2.5 Million in Funding   | The SaaS News,https://www.thesaasnews.com/news/velostics-raises-2-5-million-in-funding,6.25,Gaurav Khandelwal|Kay Aloha Villamor,Small Ventures USA|BioUrja Ventures Company|BioUrja Ventures|Cultivation Capital|Velostics, Inc.|Congress Avenue Ventures|Velostics,founder|CEO
Intellect Design Arena - The "Tech" in Fintech,https://neelchhabra.substack.com/p/intellect-design-arena-the-tech-in,221.5,Medici|John Burr Williams|Neel Chhabra|-- Frank Underwood|Shopify|Warren Buffett|Jeff Bezos|Marc Benioff|Marc Andreessen|J. K. Rowling|Wittgenstein|his|Drucker|Cust|Andy Jassy|-- Warren Buffet|-- Joel York|Plato|Clayton Christensen|Neel|Ludwig Wittgenstein|Adam Brandenburger|Bill Gurley|Feng Gu|Joseph Schumpeter|-- William Shakespeare|Aristotle|Salesforce|Jeff Lawson|George Box|-- Tiffani Bovi|Ralph Waldo Emerson|Nicholas Sleep|Schumpeter|Vincent van Gogh|-- Uday Kotak|Baruch Lev|His|Socrates|-- Ludwig Wittgenstein|Hemant Taneja|Peter Drucker|Michael Porter|Walter Wriston|Isaac Newton|Steve Blank|Elon Musk,ALM|Amazon Web Services|Intellect Quantum Central Banking Solution|Global Transaction Banking|Application Programming Interfaces|Intellect's Liquidity|IDC|Digital Lending Intellect Digital Lending|Central Government|Intellect Digital Core Marketplace|Treasury & Capital Markets|Loan Management|Harborne Stuart|Integrated Treasury & Asset and Liability Management|AMC|Naval|Artificial Intelligence and Machine Learning|Microsoft|Liquidity Management|Whale Vendors|Predictive Analytics|Fintech Marketplaces|Google|PSH|Intellect Digital Cards|Contextual Banking Exchange|SaaSification|Trade Finance|Intellect Design Arena|Treasury|Liquidity Management Solution|Amazon Elastic Compute Cloud|Central Banking|DTB|Public Sector Enterprises|Polaris|Toyota|Global Consumer Banking|Digital and Data|Polaris Consulting Services|Fraud Management|Craft of Investing and Living Life|Software-as-a-Service|Amazon|TCO|ERP|SAP|Bank|Customer Lifecycle Management|Digital Cards Intellect Digital Cards|Central Banks|Machine Learning|Digital Challenger Banks|Fund Services|LTV|School of Fish Providers|Digital Banking Platform for Cash Management|NPS|Intellect's Cloud Transformation Accelerator Platform|Intellect Digital Core|SEEC|Digital Transaction Banking|CSM|AWS|Netflix|Central Banking Solutions|PayPal|Intellect Wealth Qube|Capital Cube|Capital Markets|Mid & Back Office|Interactive Voice Response|Corporate Banking Solution arm of Intellect|Analytics|Intelligent Data Platform Intellect's Fabric Data|Supply Chain Finance|LMS|Citibank|Intellect|Credit Processing|Ford,leader|investment analyst|treasurer|Manager|CFO|layer|principal|general|evangelist|vendor|Registrar|host|model|Private|Oracle|owner|Supervisor|economist|Banker|retailer|founder|mobile|CEO|broker|banker|engineer|Mobile|Layer|entrepreneur|specialist|Model|General|analyst|developer
WebCore Avis Prix & Alternatives | Comparateur Logiciels.Pro,https://www.logiciels.pro/logiciel-saas/webcore/,31.75,Zapier|Branche|-- Réalisez,Logiciels Opérations de l'Entreprise et Logiciels Gestion des Opérations|SAP|Compatibilité & Configuration Logiciel|Pegasystems|Tibco|Computer Aided Facilities Management|PRPC|NetSuite|PeopleSoft Fonctionnalités de WebCore Voici|Oracle Business Process Management|Boltro Road Haywards Heath West Sussex|IBM|Voici|WebCore Voici,installer|Commander|mobile|premier|Manager|guide
Celonis brings data intelligence to Red Hat OpenShift Service on AWS,https://www.techrepublic.com/article/celonis-brings-data-intelligence-to-red-hat-openshift-service-on-aws/,17.5,Herrmann|Lars Herrmann,TechRepublic Premium|Google|G Suite|SAP|Red Hat|Mirosoft Azure|SLA|Microsoft Office|EMS|Celonis EMS|Google Cloud|Microsoft|Amazon|Oracle|AWS,Engineer|vendor|host|guide
AWS outage: Your response to AWS going down shouldn't be multicloud,https://www.techrepublic.com/article/aws-outage-your-response-to-aws-going-down-shouldnt-be-multicloud/,16.25,Leong,Google|Microsoft|Google Cloud,guide
Features to Leverage While Implementing Azure DevOps in Your Organization  | Hacker Noon,https://hackernoon.com/features-to-leverage-while-implementing-azure-devops-in-your-organization,24.5,Jenkins|Azure DevOps,Google|Azure Pipelines|Team Foundation Version Control|Platform Independent Azure DevOps|SLA|Microsoft|Npm|Sprint|JSF|Amazon,reader|developer|writer
Use a City Planning Analogy to Visualize and Create your Cloud Architecture | Amazon Web Services,https://aws.amazon.com/blogs/architecture/use-a-city-planning-analogy-to-visualize-and-create-your-cloud-architecture/,24.5,Marwan Al Shawi Marwan|Marwan Al Shawi|Marwan|He,Amazon Virtual Private Cloud|Amazon Web Services|Amazon Relational Database Service|Customer|VPN|DDD|Amazon VPC|VPC|University of Technology|IBM Australia|Cisco Systems|AWS,Architect|tier|architect|model|layer
Cybersecurity startup CodeHunter launches malware hunting SaaS platform - Technical.ly DC,https://technical.ly/dc/2021/12/08/codehunter-larry-roshefeld/,10.75,Roshfeld|his|Johnny|Larry Roshfeld|he,US Department of Energy|R&K Cyber Solutions|Affirm Logic Corporation|IBM,reader|CEO
Parablu SaaS | Linode Partner Program | Data Management Solution,https://parablu.com/media/parablu-to-strengthen-its-saas-offerings-through-linodes-partner-program/,9.25,Parablu Parablu|Anand Prahlad|Linode|Linode Linode|Parablu|Jonathan Hill,Google Drive|Linode Partner Program|Parablu|Microsoft|Partner Program Santa Clara,President|Vice President|CEO
Software development: Why security and constant vigilance are everyone’s responsibilities - Help Net Security,https://www.helpnetsecurity.com/2021/11/05/software-development-responsibility/,16.25,Biden|Nigel Seddon,EDR|Weekly Newsletter - E-mail|Project and Product Management|Operations|SDLC|Daily Newsletter - E-mail,mobile
Cyber complexity negatively impacts a company's ability to respond to threats - Help Net Security,https://www.helpnetsecurity.com/2021/11/18/number-cybersecurity-tools/,7.5,Amit Bareket|Maor Bin|Sagi Gidali,Weekly Newsletter - E-mail|Help Net Security|CISO|Daily Newsletter - E-mail,CEO
Fintech platform ‘Wedo’ is bringing the future of work to reality with its innovative technology ⚡️ Disrupt Magazine,https://disruptmagazine.com/fintech-platform-wedo-is-bringing-the-future-of-work-to-reality-with-its-innovative-technology/,6.75,Wedo,Valencia Digital|Indiana Gregg,CEO|Founder
Web2Apk Builder Avis Prix & Alternatives | Comparateur Logiciels.Pro,https://www.logiciels.pro/logiciel-saas/web2apk-builder/,23.0,Digby|Bomgar|Voici,Barracuda Networks|Google Analytics|Compatibilité & Configuration Logiciel|IBM|Logiciels de Devops|Voici|Amazon Lex|DSI|Logiciels Informatique|VMware Horizon|IBM Watson,installer|Builder|mobile|guide
Kiwi cybersecurity startup Onwardly raises $1 million seed round,https://www.startupdaily.net/2021/12/kiwi-cybersecurity-startup-onwardly-raises-1-million-seed-round/,10.75,Phil Howie|Zheng Li|Howie|Chris Heaslip|Onwardly|Simon Thomsen|Pushpay|she|Kendra Ross|Eliot Crowther|JD Trask|Laybuy|He|he|Phil,Kiwi|Conqa,founder|CEO|Founder|entrepreneur
Underinvestment in Multi-Cloud Security a Pressing Concern,https://securityboulevard.com/2021/11/underinvestment-in-multi-cloud-security-a-pressing-concern/,21.0,Dunne|Nathan Eddy|Pathlock|Bach|Kevin Dunne|he|Tim Bach,Valtix|Microsoft|Google Cloud,general|vice president|Author|president
Zixi Works with AWS for Advanced Monitoring,https://bubbleagency.com/zixi-works-with-aws-for-advanced-monitoring/,245.25,William Elliott|Tiffany Hutt|Lula Walmsley|John Michael McDonagh|Billie Eilish|Peter Bates|her|Jack Savoretti|Brian Tracy|Masstech|Kim Willsher|VideoIPath Pebble|Daan Oomen|Cooke|Estelle|Chris Evans|Srinivas Gankidi|Sallee Poinsette-Nash|Andy Serkis|Darmah|Cooke Anamorphics|Nida Manzoor|Evan Hansen|Tanya Rai|Rufus Jay|Emily Rowed|Melanie Webb|Laura Cabarcos|Hibino|Graham Sharp|Estelle McGechie|John Wastcoat|Lise Heidal|Cooke Optics|John Perry|Thomas Shelby|Josh Paterson|Theo Gluck|Peter Carter|Richard Stokes|Andreas Neo|Andrew Bellingham|Primestream|Sarah Koehler|Clear-Com|Joe Anderson|Katy Perry|Aline Mello Joins|Kelli Neve-Read|Alan Durrant|Jay Wallace|KELLI|Halsey|Marco Borsato|Hannah Watkins|Johann Rückel|Louise Wells|Sarah Koehler Joins Clear-Com|Tal Yarden|Diana Olifirova|Collectv|Todd Rundgren|Johann Rückel CGI|Lise|John Trautman|FreeSpeak Edge Clear-Com|Mark MacEwen|Tanya Rai Pebble|Pixway|his|Atomos|Mark Roberts|Isaac Vila|Mark Hasselmann Munich|Geoff Knight|Zixi|Kanan|Kevin Can Fk Himself|Ed Shaw|Mike Ruddell|Cooke S7/i Lenses Leicester|James Davis|Denise Williams|Nikita Panchal|Malone|Adrian|Sadie Groom|Matt Wright|Picard|Luc Petit|Greg Truax|Geoffrey Hall|Maggie Rogers|Kerry Norman|Ariana Grande|Melonie Dodaro|Vinit Borrison|Larry Smith|Romeo Santos|Srinivas|Lee Chaney|he|Deloitte,Telstra Broadcast Services Joins the SRT Alliance|Bild|Mark Roberts Motion Control|Ernst & Young LLP|SCISYS Media Solutions to Showcase Cross-Media Storytelling Solutions For TV News and Radio|BBC|Amazon Web Services|TwistedPair Develop Partnership to Provide Powerful Analytics|NAB NY At NAB Show NY|CDI|Arvato Broadcast Systems|BSC|Dolby Atmos|EMG Group|NEP Group Adds Signiant Media Shuttle|M&E Masstech|Organization Of American States|Savannah College|Epic Games' Innovation Lab Surrey|Jeffersonville High School TV & Radio Broadcast Program|House Of Dancing Water|MediaCloud|Lightware Visual Engineering|NAB Show|CVP|Value of Influencers|Surrey|Savannah Film Studios|Lightworks NLE|RCS|IBC2019 Primestream|IBC|SVP|Cooke Optics|ASC|Canon|Buckinghamshire New University|SCAD|Sony Alpha|ASG|Telstra Broadcast Services Pty Limited|AV System Control Solution Los Angeles|Advanced Systems Group|MORE London Symphony Orchestra Conducts Perfect Wireless Communications|Elevation Church|Netflix|MORE Visual Data Media Services|MORE National Broadcasting Services|AQC LWKS Software Ltd|Old Navy|Pinewood Studios|NAGOYA BROADCASTING NETWORK|Melos Publishing Services Appoints Bubble Agency|Adtech Systems Develop Managed Services|Global Media Network China|Visual Data Media Services|PSSI Global Services Telstra Broadcast Services|NantStudios|AT&T|Inter|SVP Alliances and Marketing|GPU|APAC|XR Studios|Bild Studios|Atomos|DPP Innovation Week|NewTek|Lightware Visual Engineering Utelogy Corporation|Post Malone Spans The Globe On `Beerbongs & Bentleys|Kia|Solutions Partners|Noel Coward Theatre|National Broadcasting Services|Board of Directors of Broadcast Pix|Pebble Beach Systems Unveils Rebrand Ahead of 21st Anniversary Industry|Shaanxi Tourism Group|National Archives of Estonia Prasad Corp|AES|Intercom Technology ALAMEDA|AI Archiving Technology Asharq News|Sony Group Company|Group Strategy|OWNZONES Entertainment Technologies Bubble Agency|Bluman Associates Acquire First|Broadcast Pix Bubble Agency|BBC Studios Entertainment Productions|Quortex I/O|OAS|EMEA PR Agency Bubble Agency|Appoints Bubble Agency|Drive Restoration & Preservation Business Visual Data Media Services|Telstra|Twitter|Strategic Marketing Partner Advanced Systems Group|SCC AVS Develop Partnership to Enhance Management|Ncam Technologies|WorldCast Systems|Singular.live Continues Democratisation of Broadcast Graphics|AWS Cloud Digital Interface|Utelogy Corporation|Jeffersonville High School|U.S. Media Technology Company|Ampco|UNO|Cooke miniS4/i Lenses Capture Unique Wildlife Footage for Seven Worlds|AWS|Pebble Beach Systems|LEA Professional Utelogy Corporation|Portland Timbers|Mojo Development|Agency|Cooke Optics Brings BAFTA|New Soho London Based Post Production Facilities|Amazon Elastic Fabric Adapter|Vizrt Group|NAB|Pebble Control|MetLife|UHD Digital Media Production|PR Consultancy for North America Bubble Agency|TCAN|AV Managed Services|Marketing and Social Media Services|Adtech Systems|Nightclubs Across China|ITV Studios|LightBox Expo Online|Glossy Look Cooke Optics|NBA|M6 Group|Sunday Times|Telstra Global Media Network|Masstech|Telstra Broadcast Services|Mass Communications|Customer Association Meetings|SDCX SaaS Platform Signiant Inc.|Xencelabs Signs Liquid PC|University of Montevallo Team Give Students|Google|PHABRIX Ltd|FC Barcelona|CMO|New Six Month Mentoring Programme|Independent Council|Cardiff Metropolitan University Produces Industry Ready Broadcasting Students With Newtek Solutions Cardiff Metropolitan University|Hibino Group|NEW AGRIBUSINESS CHANNEL AGRO|House|Advanced Data London|Media Production and Technology Show|RBS TV Weybridge|Bring Black Friday Online for Retailer PrettyLittleThing Black|Xencelabs Technologies Ltd.|Intercom Innovation for Broadcast Productions|Media Asset Management|Electronics Corporation|Amazon|DPP|UC Estates Los Angeles|The Entertainment Globalization Association|Evolve Media Group Announce New Partnership Evolve|Interra Systems|AGITO Sports|NDI|Nederlander Worldwide Entertainment|BAFTA|Prasad Corp|NDR|Arvato|Sony|Asharq News Partners|Bertelsmann|Broadcast Operations Center|EMEA|X2X Media Group|Pip Studios|Walmart|Ricoh|Saudi Research and Media Group|NEP|LG|Red Bee Media|Picard Star Trek|Digital Marketing|Natick MA|Atomos Shogun|Lesspain Software|MTV|Sustainability Programme|Social Media Services|AMC|AGITO Academy Bristol|Facebook|Lightware Visual Engineering UK & Ireland|TBS|MORE Entertainment Globalization Association Appoints Bubble Agency|TripAdvisor|Newman House Showroom London|SCC AVS|LSO|Control of the Video-Enabled Workplace Utelogy Corporation|Everlast Productions|MORE Visual Data Media Services Taps|Amazon Elastic Compute Cloud|University of Montevallo|UEC|Nikon|Major League Soccer|Samsung|Nagoya Broadcasting Network|Organization of American States|INC|EFA|Boundaries Of Album Promotion For Black Eyed Peas|SCHOLASTIC|Zync Customers GridMarkets|US Team Season|Les Misérables|MTV VMAs|Brandable & Co.|Primestream Showing Advanced Acquisition Capabilities|NEP Group|CBS|Prudential Center|EGA|Incheon Culture and Arts Center|Power of Coaching|MRMC|Digital Competitor Analysis Whilst|Renault|Signiant Inc.|Global Business Development Director for Sports & Broadcast|Arvato Systems|Scalability Utelogy Corporation|Marketing Partner Bubble Agency|Ocean Floor Geophysics Relies on Clear-Com & GerrAudio for Rock-Solid Communications In Ocean Floor Geophysics|DVI|Media Group Announces Formation of Specialized Production Services Division X2X Media Group|EditShare - Lightworks NLE|Bubble Agency|Center for Arts|Global Media Solutions|CATS Ltd.|X2X Media Group X2X Media Group,leader|electrician|broadcaster|DJ|cinematographer|Manager|Director of Photography|Marketing Director|shopkeeper|host|MANAGER|model|king|director|Director|CEO|Managing Director|Gen|smoother|driver|specialist|producer|singer/songwriter|Chopper|Guide|singer|Leader|artist|architect|Driver|executive coach|manufacturer|Designer|Analyst|tier|artistic director|owner|creator|pilot|mobile|premier|Host|Creative Director|Mobile|actor|analyst|Cinematographer|developer|Entrepreneur|Sales Manager
Vivid Reports Flex Avis Prix & Alternatives | Comparateur Logiciels.Pro,https://www.logiciels.pro/logiciel-saas/vivid-reports-flex/,27.25,Jedox|Digitalbarriers|Hadoop|Jornaya,Business Intelligence|Compatibilité & Configuration Logiciel|SAP|KPI|TIBCO Spotfire|OLAP|IBM SPSS|Vivid Reports Flex|Logiciels Business Intelligence|Fonctionnalités de Vivid Reports Flex Voici|Business Intelligence -LRB-Analytics|Cognos|Informatique|Voici|Microsoft,installer|mobile|tester|guide
Broadcom acquires AppNeta to provide IT teams with end-to-end visibility into network performance - Help Net Security,https://www.helpnetsecurity.com/2021/12/09/broadcom-appneta/,8.25,Serge Lucio|Stephen Elliot,Enterprise Software Division|Broadcom Software|AppNeta Inc.|Market Guide for Network Performance Monitoring|AppNeta|Weekly Newsletter - E-mail|IDC|Gartner Inc.|Broadcom|Daily Newsletter - E-mail,vice president|general manager|mobile|Vice President
Rewind recovers and protects vital data with Backups for Microsoft 365 - Help Net Security,https://www.helpnetsecurity.com/2021/12/09/rewind-backups-for-microsoft-365/,7.75,Shopify|Jira|Mike Potter,QuickBooks Online|Weekly Newsletter - E-mail|Microsoft|Insight Partners|Daily Newsletter - E-mail,Model|CEO|co-founder
Gov Tech Buying Frenzy Likely to Continue in 2022 and Beyond,https://www.govtech.com/biz/gov-tech-buying-frenzy-likely-to-continue-in-2022-and-beyond,18.0,Palmer|Douglas|Biden|He,Congress|ARR|Ascend Capital Group|Tyler Technologies|State Department,DJ|director|representative
Types of Cloud Computing Services | Leading Edge,https://www.leadingedgetech.co.uk/it-services/it-consultancy-services/cloud-computing/what-are-the-types-of-cloud-computing/,5.5,,Customisable Cons,mobile|Private|model
DevOps — The Next Best Solution for CRM,https://softclouds.medium.com/devops-the-next-best-solution-for-crm-961ef174a395,31.0,Jenkins|CodeNarc|Copado,Business Intelligence|ERP|Siebel|Customer Relationship Management|UAT|API|3M|Digital Transformation journey|OEC|AIOps|Hybrid Product Teams,leader|model|developer|Oracle|Manager
Look for subscription billing software with these features,https://www.gogravity.com/blog/subscription-billing-software,22.75,David Padmos|Valerie Silvani|Jeff Johnson|Ken Englund|Englund,Gravity Software|Microsoft Power BI|GAAP|Ernst & Young|EY Americas Consulting Technology Solutions,Leader|model
Web Suite Pro Avis Prix & Alternatives | Comparateur Logiciels.Pro,https://www.logiciels.pro/logiciel-saas/web-suite-pro/,19.75,Zapier|Appart-Encheres,PRPC|NetSuite|Oracle Business Process Management|IBM|Pegasystems|Voici|Tibco,installer|Commander|Manager|guide
Council Post: Building A SaaS Center Of Excellence,https://www.forbes.com/sites/forbestechcouncil/2021/12/10/building-a-saas-center-of-excellence/,11.0,,SCoE|Google|Forbes Technology Council,executive|guide
